{
  "name": "Factory Realtime Voice Changer Presets",
  "packId": "factory",
  "presets": [
    {
      "dsp": {
        "character": {
          "amount": 0.5,
          "tone": 0,
          "type": "none"
        },
        "compressor": {
          "attackMs": 8,
          "makeupGainDb": 0.5,
          "ratio": 1.8,
          "releaseMs": 120,
          "thresholdDb": -24
        },
        "deesser": {
          "frequencyHz": 7200,
          "rangeDb": 8,
          "ratio": 4,
          "thresholdDb": -28
        },
        "eq": {
          "airDb": 0.5,
          "bodyDb": 0,
          "highpassHz": 75,
          "presenceDb": 1.2
        },
        "formant": {
          "amount": 0,
          "body": 0,
          "brightness": 0.1,
          "factor": 1,
          "nasal": 0
        },
        "gate": {
          "attackMs": 2,
          "rangeDb": 18,
          "releaseMs": 100,
          "thresholdDb": -55
        },
        "harmony": {
          "delayMs": 12,
          "detuneCents": 6,
          "leadLevel": 1,
          "level": 0.7,
          "steps": [
            2,
            4,
            -3
          ],
          "voices": 0
        },
        "inputGainDb": 0,
        "limiter": {
          "ceilingDb": -1,
          "releaseMs": 50
        },
        "midi": {
          "release": "hold"
        },
        "outputGainDb": 0,
        "pitchCorrection": {
          "amount": 1,
          "keyRoot": 0,
          "mode": "off",
          "robotOctave": 0,
          "scale": "major",
          "speedMs": 20
        },
        "retune": {
          "grainSize": 0,
          "mix": 0,
          "semitones": 0
        },
        "reverb": {
          "damping": 0.55,
          "mix": 0,
          "seed": 1,
          "timeMs": 320
        },
        "reverbVariation": {
          "delayMs": 250,
          "division": "eighth",
          "feedback": 0.35,
          "tempoBpm": 120,
          "variation": "reverb"
        },
        "vocoder": {
          "attackMs": 2,
          "bands": 20,
          "carrierSource": "internal",
          "carrierWave": "saw",
          "enabled": false,
          "ensembleDetuneCents": 12,
          "level": 1,
          "releaseMs": 20,
          "sibilance": 0.3
        },
        "voiceEngine": {
          "engine": "psola",
          "f0MinHz": 70
        },
        "wetMix": 1
      },
      "id": "neutral-monitor",
      "name": "Neutral Monitor",
      "category": "monitor",
      "schemaVersion": 2
    },
    {
      "dsp": {
        "character": {
          "amount": 0.5,
          "tone": 0,
          "type": "none"
        },
        "compressor": {
          "attackMs": 4.5,
          "makeupGainDb": 2,
          "ratio": 3.2,
          "releaseMs": 75,
          "thresholdDb": -23
        },
        "deesser": {
          "frequencyHz": 7600,
          "rangeDb": 9,
          "ratio": 4,
          "thresholdDb": -30
        },
        "eq": {
          "airDb": 3.5,
          "bodyDb": -2.5,
          "highpassHz": 160,
          "presenceDb": 4.5
        },
        "formant": {
          "amount": 1,
          "body": 0,
          "brightness": 0.7,
          "factor": 1.18,
          "nasal": 0.05
        },
        "gate": {
          "attackMs": 2,
          "rangeDb": 22,
          "releaseMs": 80,
          "thresholdDb": -50
        },
        "harmony": {
          "delayMs": 12,
          "detuneCents": 6,
          "leadLevel": 1,
          "level": 0.7,
          "steps": [
            2,
            4,
            -3
          ],
          "voices": 0
        },
        "inputGainDb": 0,
        "limiter": {
          "ceilingDb": -1,
          "releaseMs": 50
        },
        "midi": {
          "release": "hold"
        },
        "outputGainDb": 2.2,
        "pitchCorrection": {
          "amount": 1,
          "keyRoot": 0,
          "mode": "off",
          "robotOctave": 0,
          "scale": "major",
          "speedMs": 20
        },
        "retune": {
          "grainSize": 0,
          "mix": 1,
          "semitones": 4
        },
        "reverb": {
          "damping": 0.35,
          "mix": 0.11,
          "seed": 7,
          "timeMs": 380
        },
        "reverbVariation": {
          "delayMs": 250,
          "division": "eighth",
          "feedback": 0.35,
          "tempoBpm": 120,
          "variation": "reverb"
        },
        "vocoder": {
          "attackMs": 2,
          "bands": 20,
          "carrierSource": "internal",
          "carrierWave": "saw",
          "enabled": false,
          "ensembleDetuneCents": 12,
          "level": 1,
          "releaseMs": 20,
          "sibilance": 0.3
        },
        "voiceEngine": {
          "engine": "psola",
          "f0MinHz": 70
        },
        "wetMix": 1
      },
      "id": "bright-idol",
      "name": "Bright Idol",
      "category": "bright",
      "schemaVersion": 2
    },
    {
      "dsp": {
        "character": {
          "amount": 0.5,
          "tone": 0,
          "type": "none"
        },
        "compressor": {
          "attackMs": 12,
          "makeupGainDb": 3,
          "ratio": 2.6,
          "releaseMs": 180,
          "thresholdDb": -28
        },
        "deesser": {
          "frequencyHz": 7000,
          "rangeDb": 10,
          "ratio": 4.5,
          "thresholdDb": -32
        },
        "eq": {
          "airDb": 2.5,
          "bodyDb": 1,
          "highpassHz": 110,
          "presenceDb": -2
        },
        "formant": {
          "amount": 0.85,
          "body": 0.2,
          "brightness": 0.25,
          "factor": 1.1,
          "nasal": -0.2
        },
        "gate": {
          "attackMs": 6,
          "rangeDb": 10,
          "releaseMs": 90,
          "thresholdDb": -62
        },
        "harmony": {
          "delayMs": 12,
          "detuneCents": 6,
          "leadLevel": 1,
          "level": 0.7,
          "steps": [
            2,
            4,
            -3
          ],
          "voices": 0
        },
        "inputGainDb": 0,
        "limiter": {
          "ceilingDb": -1,
          "releaseMs": 50
        },
        "midi": {
          "release": "hold"
        },
        "outputGainDb": 3,
        "pitchCorrection": {
          "amount": 1,
          "keyRoot": 0,
          "mode": "off",
          "robotOctave": 0,
          "scale": "major",
          "speedMs": 20
        },
        "retune": {
          "grainSize": 0,
          "mix": 1,
          "semitones": 2
        },
        "reverb": {
          "damping": 0.65,
          "mix": 0.09,
          "seed": 11,
          "timeMs": 520
        },
        "reverbVariation": {
          "delayMs": 250,
          "division": "eighth",
          "feedback": 0.35,
          "tempoBpm": 120,
          "variation": "reverb"
        },
        "vocoder": {
          "attackMs": 2,
          "bands": 20,
          "carrierSource": "internal",
          "carrierWave": "saw",
          "enabled": false,
          "ensembleDetuneCents": 12,
          "level": 1,
          "releaseMs": 20,
          "sibilance": 0.3
        },
        "voiceEngine": {
          "engine": "psola",
          "f0MinHz": 70
        },
        "wetMix": 1
      },
      "id": "soft-whisper",
      "name": "Soft Whisper",
      "category": "soft",
      "schemaVersion": 2
    },
    {
      "dsp": {
        "character": {
          "amount": 0.5,
          "tone": 0,
          "type": "none"
        },
        "compressor": {
          "attackMs": 14,
          "makeupGainDb": 1.2,
          "ratio": 3,
          "releaseMs": 140,
          "thresholdDb": -24
        },
        "deesser": {
          "frequencyHz": 6500,
          "rangeDb": 5,
          "ratio": 3.5,
          "thresholdDb": -26
        },
        "eq": {
          "airDb": -1.5,
          "bodyDb": 4,
          "highpassHz": 70,
          "presenceDb": 2
        },
        "formant": {
          "amount": 1,
          "body": 0.65,
          "brightness": -0.25,
          "factor": 0.84,
          "nasal": -0.15
        },
        "gate": {
          "attackMs": 2.5,
          "rangeDb": 18,
          "releaseMs": 120,
          "thresholdDb": -52
        },
        "harmony": {
          "delayMs": 12,
          "detuneCents": 6,
          "leadLevel": 1,
          "level": 0.7,
          "steps": [
            2,
            4,
            -3
          ],
          "voices": 0
        },
        "inputGainDb": 0,
        "limiter": {
          "ceilingDb": -1,
          "releaseMs": 50
        },
        "midi": {
          "release": "hold"
        },
        "outputGainDb": 3.5,
        "pitchCorrection": {
          "amount": 1,
          "keyRoot": 0,
          "mode": "off",
          "robotOctave": 0,
          "scale": "major",
          "speedMs": 20
        },
        "retune": {
          "grainSize": 0,
          "mix": 1,
          "semitones": -5
        },
        "reverb": {
          "damping": 0.8,
          "mix": 0.08,
          "seed": 13,
          "timeMs": 650
        },
        "reverbVariation": {
          "delayMs": 250,
          "division": "eighth",
          "feedback": 0.35,
          "tempoBpm": 120,
          "variation": "reverb"
        },
        "vocoder": {
          "attackMs": 2,
          "bands": 20,
          "carrierSource": "internal",
          "carrierWave": "saw",
          "enabled": false,
          "ensembleDetuneCents": 12,
          "level": 1,
          "releaseMs": 20,
          "sibilance": 0.3
        },
        "voiceEngine": {
          "engine": "psola",
          "f0MinHz": 70
        },
        "wetMix": 1
      },
      "id": "deep-narrator",
      "name": "Deep Narrator",
      "category": "deep",
      "schemaVersion": 2
    },
    {
      "dsp": {
        "character": {
          "amount": 0.5,
          "tone": 0,
          "type": "none"
        },
        "compressor": {
          "attackMs": 2,
          "makeupGainDb": 2.5,